step_order,step_id,action,evidence_required,command
1,screen_reviewers,Screen two qualified reviewers per language pair using the sprint screener.,six qualified reviewer slots with non-placeholder IDs,
2,fill_roster,Fill the current-model annotator roster with qualified reviewer IDs and notes.,data/current_model_human_audit/human_audit_annotator_roster_v0.2_current_gpt5.csv,
3,send_bundles,Send the three blinded current-model bundles to reviewer1 and reviewer2 for each language pair.,six returned completed CSV files with the expected reviewer1/reviewer2 names,
4,merge_double_labels,Merge the six reviewer returns into the double-label packet.,data/current_model_human_audit/human_audit_packet_v0.2_current_gpt5_double_completed.csv,conda run -n reprompt_tax python scripts/merge_review_exports.py --mode human_audit --launch-packet data/current_model_human_audit/human_audit_packet_v0.2_current_gpt5.csv --out data/current_model_human_audit/human_audit_packet_v0.2_current_gpt5_double_completed.csv --labels-per-item 2 --inputs data/current_model_human_audit/human_audit_packet_v0.2_current_gpt5_ar-en_reviewer1_completed.csv data/current_model_human_audit/human_audit_packet_v0.2_current_gpt5_ar-en_reviewer2_completed.csv data/current_model_human_audit/human_audit_packet_v0.2_current_gpt5_es-en_reviewer1_completed.csv data/current_model_human_audit/human_audit_packet_v0.2_current_gpt5_es-en_reviewer2_completed.csv data/current_model_human_audit/human_audit_packet_v0.2_current_gpt5_hi-en_reviewer1_completed.csv data/current_model_human_audit/human_audit_packet_v0.2_current_gpt5_hi-en_reviewer2_completed.csv
5,analyze_disagreements,Generate the disagreement packet for adjudication.,current-model disagreement and adjudication artifacts,"conda run -n reprompt_tax python scripts/analyze_human_audit_adjudication.py --annotations data/current_model_human_audit/human_audit_packet_v0.2_current_gpt5_double_completed.csv --answer-key data/current_model_human_audit/human_audit_answer_key_v0.2_current_gpt5.csv --annotator-roster data/current_model_human_audit/human_audit_annotator_roster_v0.2_current_gpt5.csv --expected-models gpt-5.4-mini,gpt-5.5 --out-dir results/tables/current_model_human_audit_v0.2_adjudication --out-md paper/human_audit_adjudication_v02_current_gpt5.md"
6,finalize_adjudicated_labels,Finalize one adjudicated label row per audit item.,data/current_model_human_audit/human_audit_packet_v0.2_current_gpt5_completed.csv,"conda run -n reprompt_tax python scripts/finalize_human_audit_adjudication.py --annotations data/current_model_human_audit/human_audit_packet_v0.2_current_gpt5_double_completed.csv --answer-key data/current_model_human_audit/human_audit_answer_key_v0.2_current_gpt5.csv --annotator-roster data/current_model_human_audit/human_audit_annotator_roster_v0.2_current_gpt5.csv --expected-models gpt-5.4-mini,gpt-5.5 --adjudication results/tables/current_model_human_audit_v0.2_adjudication/human_audit_adjudication_packet.csv --out data/current_model_human_audit/human_audit_packet_v0.2_current_gpt5_completed.csv --source-out results/tables/current_model_human_audit_v0.2_adjudication/human_audit_final_label_sources.csv"
7,validate_finalized_labels,Validate the completed current-model human audit labels and roster.,completed human-audit validation passed,"conda run -n reprompt_tax python scripts/validate_completed_human_audit.py --annotations data/current_model_human_audit/human_audit_packet_v0.2_current_gpt5_completed.csv --answer-key data/current_model_human_audit/human_audit_answer_key_v0.2_current_gpt5.csv --annotator-roster data/current_model_human_audit/human_audit_annotator_roster_v0.2_current_gpt5.csv --expected-models gpt-5.4-mini,gpt-5.5"
8,summarize_finalized_labels,Summarize finalized labels before any claim wording changes.,current-model human-audit summary tables,conda run -n reprompt_tax python scripts/summarize_human_audit.py --annotations data/current_model_human_audit/human_audit_packet_v0.2_current_gpt5_completed.csv --answer-key data/current_model_human_audit/human_audit_answer_key_v0.2_current_gpt5.csv --out-dir results/tables/human_audit_v0.2_current_gpt5
